domain,article_count,avg_relevance,max_relevance,latest_seen_date,sample_title,sample_url,trust_score,regulator_score,source_type,priority_score,is_new_source
newsmakerslive.org,1,0.0,0,,From Ban to Oversight: CBN Signals Shift in Nigeria’s Digital Asset Policy - newsmakerslive.org,https://newsmakerslive.org,2,0,Media,4.25,True
nigeriahousingmarket.com,1,0.0,0,,Nigeria’s New Anti-Money Laundering Rules Ranked Among World’s Best – Report - nigeriahousingmarket.com,https://www.nigeriahousingmarket.com,0,0,FIU/AML,1.25,True
niskanencenter.org,1,0.0,0,,"Doing as they say, not as they do: The Trump administration's golden passport problem - Niskanen Center",https://www.niskanencenter.org,2,0,Other,4.25,True
nomadlawyer.org,1,0.0,0,,XRP price prediction: Standard Chartered targets $28 surge in 2026 - Nomad Lawyer,https://www.nomadlawyer.org,2,0,Media,4.25,True
occrp.org,1,0.0,0,,‘Mr. X’ Revealed: U.K. Freezes $108M in Properties Purchased by Wanted Chinese National - Organized Crime and Corruption Reporting Project | OCCRP,https://www.occrp.org,2,2,Other,7.25,True
onlinecasinoreports.com,1,0.0,0,,Italy to Release Final Draft of Land - Based Gambling Reforms on April 10,https://www.onlinecasinoreports.com/articles/italy-to-release-final-draft-of-land-based-gambling-reforms-on-april-10.php,0,0,Other,1.25,True
openaccessgovernment.org,1,0.0,0,,Tackling poor practices in motor finance claims through FCA taskforce - Open Access Government,https://www.openaccessgovernment.org,2,2,Regulator,7.25,True
ourfinancialsecurity.org,1,0.0,0,,"Statement: Tom Feltner, Associate Director of Consumer Policy on the Consumer Financial Protection Bureau’s New Proposed Layoff Plan - Americans for Financial Reform",https://ourfinancialsecurity.org,2,2,Regulator,7.25,True
pmnewsnigeria.com,1,0.0,0,,FCMB limits exposure in Fraud attempt - pmnewsnigeria.com,https://pmnewsnigeria.com,0,0,Media,1.25,True
polity.org.za,1,0.0,0,,Leaving South Africa is not a tax strategy: The hidden cost of a silent exit - Polity.org.za,https://www.polity.org.za,1,0,Other,2.75,True
ppc.land,1,0.0,0,,UK regulators warn agentic AI is already here - and it needs watching now - PPC Land,https://ppc.land,1,2,Other,5.75,True
professionalplanner.com.au,1,0.0,0,,"Fiducian rejects APRA concerns, says processes blocked Shield and First Guardian - Professional Planner",https://www.professionalplanner.com.au,1,2,Other,5.75,True
rawstory.com,1,0.0,0,,White House insiders put on notice as federal prosecutors look into insider trading,https://www.rawstory.com/white-house-insider-trading-investigation/,0,2,Regulator,4.25,True
realnewsmagazine.net,1,0.0,0,,CBN raises ₦4.65trn to strengthen financial system resilience - Realnews Magazine,https://realnewsmagazine.net,1,0,Media,2.75,True
responsible-investor.com,1,0.0,0,,"ISSB moves forward on nature-related metrics, targets and transition plans - Responsible Investor",https://www.responsible-investor.com,0,0,Other,1.25,True
reuters.com,1,0.0,0,,The Clarity Act and the future digital asset market - Reuters,https://www.reuters.com,0,0,Media,1.25,True
saamana.com,1,0.0,0,,नियमांचे पालन न करणाऱ्या तीन बँकांना दंड,https://www.saamana.com/fines-imposed-on-three-banks-for-non-compliance-with-regulations/,0,0,Other,1.25,True
scmp.com,1,0.0,0,,"Opinion | Dubai loss could be Hong Kong gain , but only if city is ready",https://www.scmp.com/opinion/hong-kong-opinion/article/3347848/dubais-loss-could-be-hong-kongs-gain-only-if-city-ready,0,0,Other,1.25,True
secnews.gr,1,0.0,0,,UK: Apple's Irish subsidiary fined - SecNews.gr,https://www.secnews.gr,1,2,Regulator,5.75,True
securityweek.com,1,0.0,0,,"Lloyds Data Security Incident Impacts 450,000 Individuals - securityweek.com",https://www.securityweek.com,0,2,Regulator,4.25,True
solicitornews.co.uk,1,0.0,0,,Regulators Launch Taskforce on Motor Finance Claims Practices - Solicitor News,https://solicitornews.co.uk,1,2,Media,5.75,True
southasianherald.com,1,0.0,0,,Beyond Diplomatic Assurances: Why Bangladesh Must Hold Its Embassies Accountable on Money Laundering - South Asian Herald,https://southasianherald.com,0,0,FIU/AML,1.25,True
standard.co.uk,1,0.0,0,,Lenders to have greater flexibility offering higher loan to income mortgages - London Evening Standard,https://www.standard.co.uk,1,0,Other,2.75,True
stocktitan.net,1,0.0,0,,"SHG SEC Filings - Shinhan Finan 10-K, 10-Q, 8-K Forms - Stock Titan",https://www.stocktitan.net,1,2,Regulator,5.75,True
sudanile.com,1,0.0,0,,لجنة إزالة التمكين واسترداد الأموال العامة في السودان : ( الجزء الثاني ) ,https://sudanile.com/%D9%84%D8%AC%D9%86%D8%A9-%D8%A5%D8%B2%D8%A7%D9%84%D8%A9-%D8%A7%D9%84%D8%AA%D9%85%D9%83%D9%8A%D9%86-%D9%88%D8%A7%D8%B3%D8%AA%D8%B1%D8%AF%D8%A7%D8%AF-%D8%A7%D9%84%D8%A3%D9%85%D9%88%D8%A7%D9%84-%D8%A7-2/,0,0,Other,1.25,True
superreview.com.au,1,0.0,0,,Challenger and Allianz Retire+ welcome APRA’s retirement income reforms - superreview.com.au,https://www.superreview.com.au,1,2,Other,5.75,True
sustainabilitymag.com,1,0.0,0,,ING: Sustainable Finance to Reach US$1.62tn in 2026 - Sustainability Magazine,https://sustainabilitymag.com,0,0,Other,1.25,True
the-star.co.ke,1,0.0,0,,DPP secures arrest warrant of immigration officer in human - trafficking case,https://www.the-star.co.ke/news/2026-04-01-dpp-secures-arrest-warrant-for-immigration-officer-in-trafficking-case,1,2,Regulator,5.75,True
thebusinessjournal.com,1,0.0,0,,Public Notices 4 / 1 / 2026,https://thebusinessjournal.com/public-notices-4-1-2026/,0,0,Other,1.25,True
theglobeandmail.com,1,0.0,0,,"Companies in carbon-intensive industries pay higher interest rates on their bonds, study shows - The Globe and Mail",https://www.theglobeandmail.com,0,0,Other,1.25,True
thehansindia.com,1,0.0,0,,Understanding the National Sustainability Reporting Framework (NSRF) - The Hans India,https://www.thehansindia.com,0,0,Other,1.25,True
theherald.co.za,1,0.0,0,,Cabinet hails R2 - trillion Sars milestone and outlines investment drive,https://www.theherald.co.za/news/2026-04-02-cabinet-hails-r2-trillion-sars-milestone-and-outlines-investment-drive/,1,0,Other,2.75,True
thekanal.in,1,0.0,0,,"RBI Penalties on PSBs Raise Questions on Accountability, Says Devidas Tuljapurkar - Thekanal",https://thekanal.in,1,0,Other,2.75,True
thelec.net,1,0.0,0,,UiPath Launches Agentic AI Financial Solution - thelec.net,https://www.thelec.net,1,0,Other,2.75,True
theshillongtimes.com,1,0.0,0,,Liquor policy case : Delhi HC issues notice to Kejriwal on ED plea,https://theshillongtimes.com/2026/04/01/liquor-policy-case-delhi-hc-issues-notice-to-kejriwal-on-ed-plea/,0,0,Other,1.25,True
thetimes.com,1,0.0,0,,The fugitive who bought seven London flats in one day for £11.5m - The Times,https://www.thetimes.com,0,0,Other,1.25,True
timeslive.co.za,1,0.0,0,,Cabinet hails R2 - trillion Sars milestone and outlines investment drive,https://www.timeslive.co.za/news/south-africa/2026-04-02-cabinet-hails-r2-trillion-sars-milestone-and-outlines-investment-drive/,1,0,Other,2.75,True
timestabloid.com,1,0.0,0,,Big News for XRP: SBI Japan Starts Distributing Ripple’s RLUSD Today - Times Tabloid,https://timestabloid.com,0,0,Media,1.25,True
today.thefinancialexpress.com.bd,1,0.0,0,,When rape is not 'just' a crime - The Financial Express,https://today.thefinancialexpress.com.bd,1,0,Media,2.75,True
togofirst.com,1,0.0,0,,Togo reviews NGO oversight under anti-money laundering reforms - Togo First,https://www.togofirst.com,0,0,FIU/AML,1.25,True
tracxn.com,1,0.0,0,,"Unicorn startups in Israel (Mar, 2026) - Tracxn",https://tracxn.com,0,0,Other,1.25,True
tradebrains.in,1,0.0,0,,Sattrix Secures Rs 9.30 Cr Cybersecurity Contract from SBI; Stock Gains 249% in a Year - Trade Brains,https://tradebrains.in,1,2,Regulator,5.75,True
tradingkey.com,1,0.0,0,,Goldman Sachs Group Inc Stock (GS) Moved Up by 4.95% on Mar 31: Facts Behind the Movement - TradingKey,https://www.tradingkey.com,0,0,Other,1.25,True
trtworld.com,1,0.0,0,,Nepal arrests former energy minister in money laundering probe - TRT World,https://www.trtworld.com,0,0,FIU/AML,1.25,True
tvcnews.tv,1,0.0,0,,"CBN Selects Flutterwave, Paystack, Others For Virtual Assets Oversight Pilot - - TVC News",https://www.tvcnews.tv,1,0,Media,2.75,True
ukranews.com,1,0.0,0,,NBU doubts professional competence of Ukrposhta CEO Smilianskyi - Українські Новини,https://ukranews.com,0,0,Media,1.25,True
uktech.news,1,0.0,0,,The new competitive advantage - UKTN,https://www.uktech.news,1,0,Media,2.75,True
undp.org,1,0.0,0,,"Nature Is Business: How biodiversity standards can unlock finance, strengthen competitiveness, and secure Rwanda’s economic future - United Nations Development Programme",https://www.undp.org,2,2,Regulator,7.25,True
vajiramandravi.com,1,0.0,0,,AI in Internal Security India’s Predictive Policing and Cybercrime Control Framework - Vajiram & Ravi,https://vajiramandravi.com,0,2,Regulator,4.25,True
wealthmanagement.com,1,0.0,0,,Recognizing Signs of Money Laundering - Wealth Management,https://www.wealthmanagement.com,0,0,FIU/AML,1.25,True
weeklyblitz.net,1,0.0,0,,Unseized Florida properties raise questions in Nigerian corruption case against former education official,https://weeklyblitz.net/2026/04/01/unseized-florida-properties-raise-questions-in-nigerian-corruption-case-against-former-education-official/,1,0,Other,2.75,True
wired-gov.net,1,0.0,0,,GAD contributes to cross government climate conference - Wired-Gov,https://www.wired-gov.net,1,0,Other,2.75,True
wnp.pl,1,0.0,0,,Czas na legalizację kasyn on - line ?  Nie chcemy robić z Polski drugiego Las Vegas  ,"https://www.wnp.pl/rynki/czas-na-legalizacje-kasyn-on-line-nie-chcemy-robic-z-polski-drugiego-las-vegas,1048321.html",1,0,Other,2.75,True
yahoo.com,1,0.0,0,,"Lawsuit alleges racketeering , conspiracy at Resorts World Las Vegas",https://www.yahoo.com/news/articles/lawsuit-alleges-racketeering-conspiracy-resorts-004319690.html,0,0,Legislation,1.25,False
yangtse.com,1,0.0,0,,精准服务筑根基 深耕客群提质效 江南农商银行武进高新区支行践行本土金融使命赋能区域发展,https://www.yangtse.com/news/jiangsu/202604/t20260401_337762.html,0,0,Other,1.25,True
